{
  "assets": [],
  "classes": [
    "D.1"
  ],
  "difficulty": null,
  "id": "phys_736d292003d24b5fac9aa9f355c094bb",
  "level": "hl",
  "marks": null,
  "markscheme": {
    "html": "<p><strong>Answer:</strong> B</p>"
  },
  "paper": "paper_1a",
  "question": {
    "html": "<p>Two isolated point masses, <span class=\"math\" data-latex=\"M\"></span> and <span class=\"math\" data-latex=\"16M\"></span>, are separated by a distance <span class=\"math\" data-latex=\"d\"></span>. At what distance from the center of the mass <span class=\"math\" data-latex=\"M\"></span> is the resultant gravitational field strength zero?</p><ol class=\"mcq-options\"><li data-label=\"A\"><p><span class=\"math\" data-latex=\"0.06d\"></span></p></li><li data-label=\"B\"><p><span class=\"math\" data-latex=\"0.20d\"></span></p></li><li data-label=\"C\"><p><span class=\"math\" data-latex=\"0.25d\"></span></p></li><li data-label=\"D\"><p><span class=\"math\" data-latex=\"0.80d\"></span></p></li></ol>"
  },
  "review": {
    "assets": "approved",
    "classification": "approved",
    "content": "approved",
    "issues": [],
    "status": "approved"
  },
  "schema_version": "question.v4",
  "type": "mcq"
}
