{
  "assets": [
    {
      "alt": "Source question diagram 1",
      "file": "assets/6d722887e05d9223194465da9cdd6bed6a126b137a6a38367d1ecde440927068.jpg",
      "id": "fig_01",
      "media_type": "image/jpeg",
      "placement_status": "placed",
      "role": "question_diagram",
      "sha256": "6d722887e05d9223194465da9cdd6bed6a126b137a6a38367d1ecde440927068"
    }
  ],
  "classes": [
    "B.1"
  ],
  "difficulty": null,
  "id": "phys_5c324876f53c4670827ebbec10079761",
  "level": "sl",
  "marks": null,
  "markscheme": {
    "html": "<p><strong>Answer:</strong> A</p>"
  },
  "paper": "paper_1a",
  "question": {
    "html": "<p>Two liquid samples, X and Y, have the same mass. The graph shows <span class=\"math\" data-latex=\"\\Delta T\"></span> versus <span class=\"math\" data-latex=\"Q\"></span> for samples X and Y.</p>\n<p><figure data-asset-id=\"fig_01\"><img alt=\"Source question diagram 1\" src=\"asset:fig_01\"/></figure></p>\n<p>What is the ratio <span class=\"math\" data-latex=\"\\frac{\\text{specific heat capacity of X}}{\\text{specific heat capacity of Y}}\"></span>?</p><ol class=\"mcq-options\"><li data-label=\"A\"><p><span class=\"math\" data-latex=\"0.25\"></span></p></li><li data-label=\"B\"><p><span class=\"math\" data-latex=\"0.50\"></span></p></li><li data-label=\"C\"><p><span class=\"math\" data-latex=\"2.0\"></span></p></li><li data-label=\"D\"><p><span class=\"math\" data-latex=\"4.0\"></span></p></li></ol>"
  },
  "review": {
    "assets": "approved",
    "classification": "approved",
    "content": "approved",
    "issues": [],
    "status": "approved"
  },
  "schema_version": "question.v4",
  "type": "mcq"
}
