{
  "assets": [],
  "classes": [
    "A.2",
    "A.3"
  ],
  "difficulty": 3,
  "id": "phys_8b6df80468204f48886f217e56e8cab5",
  "level": "sl",
  "marks": null,
  "markscheme": {
    "html": "<p><strong>Answer:</strong> C</p>"
  },
  "paper": "paper_1a",
  "question": {
    "html": "<p>An object of mass <span class=\"math\" data-latex=\"m\"></span>, moving with a speed <span class=\"math\" data-latex=\"v\"></span>, collides with a stationary object of mass <span class=\"math\" data-latex=\"m\"></span>. The objects stick together.</p>\n<p>What is the change in kinetic energy in the collision?</p>\n<ol class=\"mcq-options\"><li data-label=\"A\">Zero</li><li data-label=\"B\"><span class=\"math\" data-latex=\"\\frac{mv^{2}}{8}\"></span></li><li data-label=\"C\"><span class=\"math\" data-latex=\"\\frac{mv^{2}}{4}\"></span></li><li data-label=\"D\"><span class=\"math\" data-latex=\"\\frac{3mv^{2}}{8}\"></span></li></ol>"
  },
  "review": {
    "assets": "approved",
    "classification": "approved",
    "content": "approved",
    "issues": [],
    "status": "approved"
  },
  "schema_version": "question.v4",
  "type": "mcq"
}
