{
  "assets": [],
  "classes": [
    "D.2"
  ],
  "difficulty": 3,
  "id": "phys_6dd850fb10274b5ca2c9b7b8e719b1ab",
  "level": "sl",
  "marks": null,
  "markscheme": {
    "html": "<p><strong>Answer:</strong> B</p>"
  },
  "paper": "paper_1a",
  "question": {
    "html": "<p>What is the direction of the electric field at a point near a positive point charge?</p><ol class=\"mcq-options\"><li data-label=\"A\">Toward the charge</li><li data-label=\"B\">Away from the charge</li><li data-label=\"C\">Tangent to the charge surface</li><li data-label=\"D\">Circular around the charge</li></ol>"
  },
  "review": {
    "assets": "approved",
    "classification": "approved",
    "content": "approved",
    "issues": [],
    "status": "approved"
  },
  "schema_version": "question.v4",
  "type": "mcq"
}
