{
  "assets": [
    {
      "alt": "Source question diagram 1",
      "file": "assets/ed8bfe0efeea2682533a370d4778017ed0c8b5c9a5047a81bfb10488a46e5d70.png",
      "id": "fig_01",
      "media_type": "image/png",
      "placement_status": "placed",
      "role": "question_diagram",
      "sha256": "ed8bfe0efeea2682533a370d4778017ed0c8b5c9a5047a81bfb10488a46e5d70"
    }
  ],
  "classes": [
    "E.3"
  ],
  "difficulty": 2,
  "id": "phys_8e7e80f4ca6944a8916d8f04dc57aefe",
  "level": "sl",
  "marks": 1,
  "markscheme": {
    "html": "<p><strong>Answer:</strong> C</p>"
  },
  "paper": "paper_1a",
  "question": {
    "html": "<p>Radioactive oxygen-15 <sup>15</sup><sub>8</sub>O decays according to the following equation:</p>\n<p><sup>15</sup><sub>7</sub>N+β<sup>+</sup>+ν<sub>e</sub></p>\n<p>What are the proton number and the nucleon number of nuclide <span class=\"math\" data-latex=\"X\"></span>?</p>\n<p><br/></p>\n<p><figure data-asset-id=\"fig_01\"><img alt=\"Source question diagram 1\" src=\"asset:fig_01\"/></figure></p>\n<p>[1]</p><ol class=\"mcq-options\"><li data-label=\"A\">Option A is shown in the figure above.</li><li data-label=\"B\">Option B is shown in the figure above.</li><li data-label=\"C\">Option C is shown in the figure above.</li><li data-label=\"D\">Option D is shown in the figure above.</li></ol>"
  },
  "review": {
    "assets": "approved",
    "classification": "approved",
    "content": "approved",
    "issues": [],
    "status": "approved"
  },
  "schema_version": "question.v4",
  "type": "mcq"
}
