{
  "assets": [
    {
      "alt": "Source question diagram 1",
      "file": "assets/df2c9c8660a1e937280eb30359084294dc2e850a1fdcee23e8712dded489a062.png",
      "id": "fig_01",
      "media_type": "image/png",
      "placement_status": "placed",
      "role": "question_diagram",
      "sha256": "df2c9c8660a1e937280eb30359084294dc2e850a1fdcee23e8712dded489a062"
    }
  ],
  "classes": [
    "E.3"
  ],
  "difficulty": 3,
  "id": "phys_f04d08c1f35c4de18427b32f9bcdbf38",
  "level": "sl",
  "marks": 7,
  "markscheme": {
    "html": "<section class=\"markscheme-part\" data-label=\"a\"><p><strong>a</strong></p><p>* This question is from an examination for a previous syllabus. Please note that it may contain minor differences in marking or structure or contain parts that are not a match to the new syllabus (first assessment 2025).<br/>time for activity/number of « parent » nuclei in the sample to decrease to ½ of the initial value ✔ <br/>Allow ‘number of radioactive particles’</p>\n<p>DO NOT allow ‘nuclide’</p>\n</section><section class=\"markscheme-part\" data-label=\"b\"><p><strong>b</strong></p><p>Alternative 1 «activity reduces to 1/8 after» 3 half-lives ✔ T<sub>½</sub>=« <span class=\"math\" data-latex=\"\\frac{37.0}{3}\"></span>=»12.3 «y» ✔   Alternative 2</p>\n<p><span class=\"math\" data-latex=\"A\"></span>=<span class=\"math\" data-latex=\"A_{0}\"></span>e<sup>−λt</sup> to find <span class=\"math\" data-latex=\"\\lambda\"></span>, = 0.056 «y<sup>−1</sup>» ✔</p>\n<p>half life =« <span class=\"math\" data-latex=\"\\frac{\\textit{In 2}}{\\lambda} = \\frac{\\textit{In 2}}{0.056}\"></span> =» 12.3 «y» ✔</p>\n\n</section><section class=\"markscheme-part\" data-label=\"c\"><p><strong>c</strong></p><p>alpha particle / α / <span class=\"math\" data-latex=\"_{ }^{ }\"></span> ✔</p>\n\n</section><section class=\"markscheme-part\" data-label=\"d.i\"><p><strong>d.i</strong></p><p>4 × 7.074 −2 × 1.112 −3 × 2.827 ✔ 17.6 «MeV» ✔   MP1: Any one of the following calculations: 4 × 7.074<br/>2 × 1.112<br/>3 × 2.827 MP2: correct arithmetic, leading to 17.6 MeV Must see full substitution or answer to at least 3sf for MP2</p></section><section class=\"markscheme-part\" data-label=\"d.ii\"><p><strong>d.ii</strong></p><p>some of the mass «of the reactants» converted to energy «according to Δm = <span class=\"math\" data-latex=\"\\frac{\\Delta  E}{{c}^{2}}\"></span>» ✔   Need to see a connection between mass and energy.  Ignore subsequent description of energy (released, binding energy, etc.)</p></section>"
  },
  "paper": "paper_2",
  "question": {
    "html": "<section class=\"question-part\" data-label=\"a\"><p><strong>a</strong> State what is meant by the half-life of a radioactive nuclide. [1]</p></section><section class=\"context\"><p>Tritium, <span class=\"math\" data-latex=\"_{ }^{ }\"></span>, is a radioactive isotope of hydrogen. The activity of a sample of tritium decreases to <span class=\"math\" data-latex=\"\\frac{A_{0}}{8}\"></span>  after a time of 37.0 years where <span class=\"math\" data-latex=\"A_{0}\"></span> is the initial activity.</p></section><section class=\"question-part\" data-label=\"b\"><p><strong>b</strong> Calculate the half-life of tritium. [2]</p></section><section class=\"context\"><p>Deuterium, <span class=\"math\" data-latex=\"_{ }^{ }\"></span>, and tritium undergo nuclear fusion according to:</p><p><span class=\"math\" data-latex=\"_{ }^{ }\"></span> + <span class=\"math\" data-latex=\"_{ }^{ }\"></span> → X + <span class=\"math\" data-latex=\"_{ }^{ }\"></span></p></section><section class=\"question-part\" data-label=\"c\"><p><strong>c</strong> Identify nuclide X. [1]</p></section><section class=\"context\"><p>The following data are given for binding energies per nucleon.</p><p><figure data-asset-id=\"fig_01\"><img alt=\"Source markscheme diagram 1\" src=\"asset:fig_01\"/></figure></p></section><section class=\"question-part\" data-label=\"d.i\"><p><strong>d.i</strong> Show that the energy released in this reaction is about 18 MeV. [2]</p></section><section class=\"question-part\" data-label=\"d.ii\"><p><strong>d.ii</strong> Outline why mass is not conserved in this reaction. [1]</p></section><p><figure data-asset-id=\"fig_01\"><img alt=\"Source question diagram 1\" src=\"asset:fig_01\"/></figure></p>"
  },
  "review": {
    "assets": "approved",
    "classification": "approved",
    "content": "approved",
    "issues": [],
    "status": "approved"
  },
  "schema_version": "question.v4",
  "type": "structured"
}
