{
  "assets": [
    {
      "alt": "Source question diagram 1",
      "file": "assets/b70ad81494ca436b880d73354d6cd18a8a60915ad756071d9ac85b95a510fb9c.png",
      "id": "fig_01",
      "media_type": "image/png",
      "placement_status": "placed",
      "role": "question_diagram",
      "sha256": "b70ad81494ca436b880d73354d6cd18a8a60915ad756071d9ac85b95a510fb9c"
    },
    {
      "alt": "Source question diagram 2",
      "file": "assets/0a96872f193c58cac88cc31633fa5ea651a2e44dff75d6351ddcb75ac0bbed1d.png",
      "id": "fig_02",
      "media_type": "image/png",
      "placement_status": "placed",
      "role": "question_diagram",
      "sha256": "0a96872f193c58cac88cc31633fa5ea651a2e44dff75d6351ddcb75ac0bbed1d"
    }
  ],
  "classes": [
    "A.2"
  ],
  "difficulty": 2,
  "id": "phys_5189bc1fd44f4766be38c886cbf3f271",
  "level": "sl",
  "marks": 1,
  "markscheme": {
    "html": "<p><strong>Answer:</strong> B</p>"
  },
  "paper": "paper_1a",
  "question": {
    "html": "<p>This question is duplicated in #94</p>\n<p>A disk of radius R rotates about its axis with angular speed <span class=\"math\" data-latex=\"\\omega\"></span>. Point X is at a distance of <span class=\"math\" data-latex=\"\\frac{R}{2}\"></span> from the centre and point Y is on the circumference.</p>\n<p><figure data-asset-id=\"fig_01\"><img alt=\"Source question diagram 1\" src=\"asset:fig_01\"/></figure></p>\n<p>What are the ratios of the linear speeds and the centripetal acceleration of X to Y?</p>\n<p>The linear speed of X is v<sub>X</sub> and its acceleration is a<sub>X</sub>; the linear speed of Y is v<sub>Y</sub> and its acceleration is a<sub>Y</sub>.</p>\n<p><figure data-asset-id=\"fig_02\"><img alt=\"Source question diagram 2\" src=\"asset:fig_02\"/></figure></p>\n<p>[1]</p><ol class=\"mcq-options\"><li data-label=\"A\">Option A is shown in the figure above.</li><li data-label=\"B\">Option B is shown in the figure above.</li><li data-label=\"C\">Option C is shown in the figure above.</li><li data-label=\"D\">Option D is shown in the figure above.</li></ol>"
  },
  "review": {
    "assets": "approved",
    "classification": "approved",
    "content": "approved",
    "issues": [],
    "status": "approved"
  },
  "schema_version": "question.v4",
  "type": "mcq"
}
