{
  "assets": [
    {
      "alt": "Source question diagram 1",
      "file": "assets/2f1ad88f5cca1873c50a6ebff49590f71befb34b826e94d33750698547b89178.png",
      "id": "fig_01",
      "media_type": "image/png",
      "placement_status": "placed",
      "role": "question_diagram",
      "sha256": "2f1ad88f5cca1873c50a6ebff49590f71befb34b826e94d33750698547b89178"
    }
  ],
  "classes": [
    "E.1",
    "E.3"
  ],
  "difficulty": 2,
  "id": "phys_78b4a2e8b10141d183c066672cf333f0",
  "level": "sl",
  "marks": 1,
  "markscheme": {
    "html": "<p><strong>Answer:</strong> C</p>"
  },
  "paper": "paper_1a",
  "question": {
    "html": "<p>Thorium-232 <sup>232</sup><sub>90</sub>Th is an unstable nuclide. It decays by emitting an alpha particle followed by a beta minus (β<sup>−</sup>) particle.</p>\n<p>What is the number of protons and neutrons in the final nuclide?<br/><br/></p>\n<p><figure data-asset-id=\"fig_01\"><img alt=\"Source question diagram 1\" src=\"asset:fig_01\"/></figure></p>\n<p>[1]</p><ol class=\"mcq-options\"><li data-label=\"A\">Option A is shown in the figure above.</li><li data-label=\"B\">Option B is shown in the figure above.</li><li data-label=\"C\">Option C is shown in the figure above.</li><li data-label=\"D\">Option D is shown in the figure above.</li></ol>"
  },
  "review": {
    "assets": "approved",
    "classification": "approved",
    "content": "approved",
    "issues": [],
    "status": "approved"
  },
  "schema_version": "question.v4",
  "type": "mcq"
}
